[
  { "schemaVersion": 19, "type": "approval_review_requested", "runId": "run_review_1", "sequence": 10, "at": "2026-10-21T12:00:00Z", "data": { "approvalId": "approveDeployment", "requestId": "aprreq_review_1", "reviewDigest": "sha256:aaaaaaaaaaaaaaaaaaaaaaaaaaaaaaaaaaaaaaaaaaaaaaaaaaaaaaaaaaaaaaaa", "directoryVersion": "directory-2026-10-21", "required": 2, "requiredRoles": ["production-owner", "security-owner"] } },
  { "schemaVersion": 19, "type": "approval_reviewer_decision_recorded", "runId": "run_review_1", "sequence": 11, "at": "2026-10-21T12:01:00Z", "data": { "approvalId": "approveDeployment", "requestId": "aprreq_review_1", "reviewDigest": "sha256:aaaaaaaaaaaaaaaaaaaaaaaaaaaaaaaaaaaaaaaaaaaaaaaaaaaaaaaaaaaaaaaa", "principalId": "person:alice", "decision": "approved" } },
  { "schemaVersion": 19, "type": "approval_quorum_progressed", "runId": "run_review_1", "sequence": 12, "at": "2026-10-21T12:01:00Z", "data": { "approvalId": "approveDeployment", "requestId": "aprreq_review_1", "reviewDigest": "sha256:aaaaaaaaaaaaaaaaaaaaaaaaaaaaaaaaaaaaaaaaaaaaaaaaaaaaaaaaaaaaaaaa", "required": 2, "received": 1, "requiredRoles": ["production-owner", "security-owner"], "representedRoles": ["production-owner"] } },
  { "schemaVersion": 19, "type": "approval_resolved", "runId": "run_review_1", "sequence": 15, "at": "2026-10-21T12:02:00Z", "data": { "approvalId": "approveDeployment", "requestId": "aprreq_review_1", "reviewDigest": "sha256:aaaaaaaaaaaaaaaaaaaaaaaaaaaaaaaaaaaaaaaaaaaaaaaaaaaaaaaaaaaaaaaa", "decision": "approved", "reason": "quorum", "required": 2, "received": 2, "requiredRoles": ["production-owner", "security-owner"], "representedRoles": ["production-owner", "security-owner"] } }
]
